[
  {
    "paper_id": "2018_A_A18101830082",
    "year": 2018,
    "track": "A",
    "title": "关于跳台跳水体型系数设置的建模分析",
    "award_level": "待确认",
    "award_confidence": "unknown",
    "problem_count": 3,
    "task_types": [
      "优化",
      "预测",
      "评价",
      "回归拟合",
      "机理建模"
    ],
    "models_and_algorithms": [
      "遗传算法",
      "微分方程/动力学",
      "图论/最短路",
      "刚体/多体动力学"
    ],
    "data_modality": "结构化",
    "data_scale": "小样本/题设数据",
    "validation_methods": [
      "灵敏度/敏感性分析",
      "鲁棒性/稳定性分析"
    ],
    "figure_count": 30,
    "figure_types": [
      "流程图/框图",
      "折线/曲线图"
    ],
    "innovation_points": [
      "本文可以建立出完成各个跳",
      "本文基于问题二的模型建立了新的难度系数评价指标。首先，本"
    ],
    "page_count": 45,
    "section_structure": null,
    "source_locations": [
      "摘要≈p.45",
      "模型建立≈p.2",
      "灵敏度分析≈p.6",
      "模型评价/改进≈p.32"
    ],
    "confidence": "medium",
    "notes": ""
  },
  {
    "paper_id": "2018_A_A18102690160",
    "year": 2018,
    "track": "A",
    "title": "跳台跳水体型校正系数的建模分析",
    "award_level": "待确认",
    "award_confidence": "unknown",
    "problem_count": 3,
    "task_types": [
      "分类",
      "回归拟合",
      "机理建模"
    ],
    "models_and_algorithms": [
      "多元线性回归",
      "刚体/多体动力学"
    ],
    "data_modality": "结构化",
    "data_scale": "小样本/题设数据",
    "validation_methods": [
      "对比/比较分析"
    ],
    "figure_count": 2,
    "figure_types": [],
    "innovation_points": [],
    "page_count": 10,
    "section_structure": "1 问题重述与分析；2 模型建立与求解；2 中转动惯量随时间的变化为：；6\n  完成n 周翻腾转体动作的总用时：；3 新难度系数与原系数的对比分析；4 总结与推广",
    "source_locations": [
      "模型建立≈p.1"
    ],
    "confidence": "medium",
    "notes": ""
  },
  {
    "paper_id": "2018_A_A18103000012",
    "year": 2018,
    "track": "A",
    "title": "关于跳台跳水体型系数设置的建模分析",
    "award_level": "待确认",
    "award_confidence": "unknown",
    "problem_count": 4,
    "task_types": [
      "信号处理"
    ],
    "models_and_algorithms": [
      "刚体/多体动力学"
    ],
    "data_modality": "结构化",
    "data_scale": "小样本/题设数据",
    "validation_methods": [
      "对比/比较分析"
    ],
    "figure_count": 20,
    "figure_types": [
      "折线/曲线图"
    ],
    "innovation_points": [
      "本文需要建立一个身高和体重对跳水动作"
    ],
    "page_count": 36,
    "section_structure": "一、问题重述；二、问题分析；三、模型假设；四、符号说明；五、模型求解；六、模型的评价",
    "source_locations": [
      "模型建立≈p.13",
      "模型求解≈p.4"
    ],
    "confidence": "medium",
    "notes": ""
  },
  {
    "paper_id": "2018_A_A18105000011",
    "year": 2018,
    "track": "A",
    "title": "关于跳台跳水体型系数设置的建模分析",
    "award_level": "待确认",
    "award_confidence": "unknown",
    "problem_count": 4,
    "task_types": [
      "回归拟合",
      "机理建模"
    ],
    "models_and_algorithms": [
      "多元线性回归",
      "图论/最短路",
      "运动学/插补/S型曲线",
      "刚体/多体动力学"
    ],
    "data_modality": "结构化",
    "data_scale": "小样本/题设数据",
    "validation_methods": [
      "误差/残差分析"
    ],
    "figure_count": 5,
    "figure_types": [],
    "innovation_points": [
      "首次列入奥运会项目。跳水是一项由个"
    ],
    "page_count": 27,
    "section_structure": "一、问题的重述；二、问题的分析；三、模型假设；四、符号说明；五、建模与求解；六、模型展望",
    "source_locations": [
      "摘要≈p.5"
    ],
    "confidence": "medium",
    "notes": ""
  },
  {
    "paper_id": "2018_A_A18106150026",
    "year": 2018,
    "track": "A",
    "title": "跳台跳水难度系数的体型校正分析",
    "award_level": "待确认",
    "award_confidence": "unknown",
    "problem_count": null,
    "task_types": [],
    "models_and_algorithms": [
      "刚体/多体动力学"
    ],
    "data_modality": "结构化",
    "data_scale": "小样本/题设数据",
    "validation_methods": [],
    "figure_count": null,
    "figure_types": [],
    "innovation_points": [],
    "page_count": 32,
    "section_structure": null,
    "source_locations": [
      "摘要≈p.1"
    ],
    "confidence": "low",
    "notes": "全文抽取乱码（PDF CID 字体编码问题），仅封面题目可读，正文方法/验证待确认"
  },
  {
    "paper_id": "2018_A_A18900020063",
    "year": 2018,
    "track": "A",
    "title": "关于跳台跳水体型系数设置的建模分析",
    "award_level": "待确认",
    "award_confidence": "unknown",
    "problem_count": 4,
    "task_types": [
      "机理建模"
    ],
    "models_and_algorithms": [
      "刚体/多体动力学"
    ],
    "data_modality": "结构化",
    "data_scale": "小样本/题设数据",
    "validation_methods": [],
    "figure_count": 6,
    "figure_types": [],
    "innovation_points": [],
    "page_count": 41,
    "section_structure": "一、问题重述；二、模型假设；三、符号说明；四、问题一的求解；五、问题二模型的建立与求解；六、问题三的求解；七、问题四的求解；八、总结；九、参考文献",
    "source_locations": [],
    "confidence": "medium",
    "notes": ""
  },
  {
    "paper_id": "2018_B_B18102520096",
    "year": 2018,
    "track": "B",
    "title": "光传送网建模与价值评估",
    "award_level": "待确认",
    "award_confidence": "unknown",
    "problem_count": 3,
    "task_types": [
      "优化",
      "评价",
      "仿真",
      "信号处理",
      "空间图"
    ],
    "models_and_algorithms": [
      "遗传算法",
      "图论/最短路",
      "光通信/半导体仿真"
    ],
    "data_modality": "时序/信号",
    "data_scale": "小样本/题设数据",
    "validation_methods": [
      "对比/比较分析",
      "鲁棒性/稳定性分析",
      "精度指标(RMSE/R²等)"
    ],
    "figure_count": 6,
    "figure_types": [
      "流程图/框图",
      "折线/曲线图"
    ],
    "innovation_points": [],
    "page_count": 49,
    "section_structure": "8\n的功率谱是两支路信号功率谱的叠加。",
    "source_locations": [
      "模型建立≈p.2"
    ],
    "confidence": "medium",
    "notes": ""
  },
  {
    "paper_id": "2018_B_B18102800030",
    "year": 2018,
    "track": "B",
    "title": "光传送网建模与价值评估",
    "award_level": "待确认",
    "award_confidence": "unknown",
    "problem_count": 5,
    "task_types": [
      "优化",
      "评价"
    ],
    "models_and_algorithms": [
      "光通信/半导体仿真"
    ],
    "data_modality": "时序/信号",
    "data_scale": "小样本/题设数据",
    "validation_methods": [
      "对比/比较分析",
      "鲁棒性/稳定性分析"
    ],
    "figure_count": 6,
    "figure_types": [
      "流程图/框图",
      "折线/曲线图"
    ],
    "innovation_points": [],
    "page_count": 32,
    "section_structure": "一、问题重述；二、问题假设；三、符号说明与数据来源；四、问题一：光传送链路建模；五、问题二：光传送网规划；六、问题三：调制格式改进；七、总结与展望",
    "source_locations": [
      "模型建立≈p.2",
      "模型求解≈p.14",
      "模型评价/改进≈p.5"
    ],
    "confidence": "medium",
    "notes": ""
  },
  {
    "paper_id": "2018_B_B18102840008",
    "year": 2018,
    "track": "B",
    "title": "光传送网建模与价值评估",
    "award_level": "待确认",
    "award_confidence": "unknown",
    "problem_count": 3,
    "task_types": [
      "优化",
      "预测",
      "评价",
      "仿真"
    ],
    "models_and_algorithms": [
      "模拟退火",
      "图论/最短路",
      "光通信/半导体仿真",
      "禁忌搜索/启发式"
    ],
    "data_modality": "时序/信号",
    "data_scale": "小样本/题设数据",
    "validation_methods": [
      "对比/比较分析"
    ],
    "figure_count": 5,
    "figure_types": [
      "折线/曲线图"
    ],
    "innovation_points": [],
    "page_count": 38,
    "section_structure": "1 问题重述；6\n规划有无变化？；2 问题一 光传送链路建模；3\n由于功率噪声是加性噪声，所以总噪声功率为；3 问题二 光传网规划；5 模型讨论与评价；6 参考文献",
    "source_locations": [
      "模型求解≈p.37"
    ],
    "confidence": "medium",
    "notes": ""
  },
  {
    "paper_id": "2018_B_B18102840019",
    "year": 2018,
    "track": "B",
    "title": "光传送网建模与价值评估",
    "award_level": "待确认",
    "award_confidence": "unknown",
    "problem_count": 3,
    "task_types": [
      "优化",
      "评价",
      "仿真",
      "空间图",
      "控制决策"
    ],
    "models_and_algorithms": [
      "模拟退火",
      "线性规划",
      "光通信/半导体仿真",
      "禁忌搜索/启发式"
    ],
    "data_modality": "时序/信号",
    "data_scale": "小样本/题设数据",
    "validation_methods": [
      "仿真/数值验证"
    ],
    "figure_count": 27,
    "figure_types": [
      "折线/曲线图"
    ],
    "innovation_points": [],
    "page_count": 44,
    "section_structure": "一、 问题重述；二、 模型假设与说明；三、 符号说明；四、 问题一模型建立与求解；五、 问题二模型建立与求解；六、 问题三模型建立与求解；七、 结论；八、 模型评价与讨论；九、 参考文献",
    "source_locations": [
      "模型建立≈p.9",
      "模型求解≈p.11",
      "模型评价/改进≈p.42"
    ],
    "confidence": "medium",
    "notes": ""
  },
  {
    "paper_id": "2018_B_B18102860425",
    "year": 2018,
    "track": "B",
    "title": "光传送网建模与价值评估",
    "award_level": "待确认",
    "award_confidence": "unknown",
    "problem_count": null,
    "task_types": [
      "评价"
    ],
    "models_and_algorithms": [
      "光通信/半导体仿真"
    ],
    "data_modality": "结构化",
    "data_scale": "小样本/题设数据",
    "validation_methods": [],
    "figure_count": null,
    "figure_types": [],
    "innovation_points": [],
    "page_count": 67,
    "section_structure": null,
    "source_locations": [
      "摘要≈p.1"
    ],
    "confidence": "low",
    "notes": "全文抽取乱码（PDF CID 字体编码问题），仅封面题目可读，正文方法/验证待确认"
  },
  {
    "paper_id": "2018_B_B18102930014",
    "year": 2018,
    "track": "B",
    "title": "光传送网建模与价值评估",
    "award_level": "待确认",
    "award_confidence": "unknown",
    "problem_count": 3,
    "task_types": [
      "评价",
      "信号处理",
      "空间图",
      "控制决策"
    ],
    "models_and_algorithms": [
      "图论/最短路"
    ],
    "data_modality": "网络",
    "data_scale": "小样本/题设数据",
    "validation_methods": [
      "对比/比较分析",
      "仿真/数值验证"
    ],
    "figure_count": 26,
    "figure_types": [
      "流程图/框图",
      "折线/曲线图"
    ],
    "innovation_points": [
      "本文首先建立MQAM 调制解调模型，得出MQAM 的BER 和SNR 关",
      "本文分为三部分进行网络规划设计。第一部分首先构建最小生",
      "本文采用控制变量法，分别建立了星座图的概率分布模型，位"
    ],
    "page_count": 45,
    "section_structure": "3\n             问题背景；2\n             问题描述；5\n              问题一",
    "source_locations": [
      "模型建立≈p.2"
    ],
    "confidence": "medium",
    "notes": ""
  },
  {
    "paper_id": "2018_B_B18106140049",
    "year": 2018,
    "track": "B",
    "title": "光传送网建模与价值评估",
    "award_level": "待确认",
    "award_confidence": "unknown",
    "problem_count": 3,
    "task_types": [
      "优化",
      "评价",
      "仿真"
    ],
    "models_and_algorithms": [
      "动态规划",
      "信道建模/多径/OFDM",
      "光通信/半导体仿真",
      "禁忌搜索/启发式"
    ],
    "data_modality": "时序/信号",
    "data_scale": "小样本/题设数据",
    "validation_methods": [],
    "figure_count": 30,
    "figure_types": [
      "折线/曲线图"
    ],
    "innovation_points": [
      "首次在青岛至大连开通，沈阳至"
    ],
    "page_count": 43,
    "section_structure": "2\n            目 录；2\n\n以有2  N 0 / 2 。",
    "source_locations": [